{
  "schemaVersion": 1,
  "reviewerId": "reviewer-1",
  "reviewBundleSha256": "1111111111111111111111111111111111111111111111111111111111111111",
  "rubricSha256": "2222222222222222222222222222222222222222222222222222222222222222",
  "qualification": {
    "qualificationClass": "experienced-content-operator",
    "experiencedOperatorOrDirector": true,
    "attestationSignedPayloadSha256": "633fb13185126729de46fb01b706605e432fd133a1addfd95630c5eedce12f7c",
    "attestationSignatureEvidenceSha256": "a394b9f51e09b9102741df17e00165efb9fafba47bf980c69a8f6c5ea74dbf5c"
  },
  "preferred": "A",
  "arms": {
    "A": {
      "scores": {
        "businessOutcomeClarity": 4,
        "subjectAudienceActionFit": 4,
        "strategicJudgment": 4,
        "publishableUsability": 4,
        "evidenceIntegrity": 4,
        "measurementUsefulness": 4
      },
      "readyForHumanReview": true,
      "reasons": ["业务目标明确", "可直接进入人工复核"],
      "severeFlags": {
        "fabricatedFactualClaim": false,
        "wrongSubjectOrDesiredAction": false,
        "notActuallyUsable": false,
        "rightsOrPrivacyViolation": false
      }
    },
    "B": {
      "scores": {
        "businessOutcomeClarity": 3,
        "subjectAudienceActionFit": 3,
        "strategicJudgment": 3,
        "publishableUsability": 3,
        "evidenceIntegrity": 3,
        "measurementUsefulness": 3
      },
      "readyForHumanReview": true,
      "reasons": ["结构完整"],
      "severeFlags": {
        "fabricatedFactualClaim": false,
        "wrongSubjectOrDesiredAction": false,
        "notActuallyUsable": false,
        "rightsOrPrivacyViolation": false
      }
    }
  },
  "signedAt": "2026-08-28T08:00:00Z",
  "signedPayloadSha256": "b1e05f57ce808dea091c5dd373e13e4f40c73933011dfc8bceacda473b79b719",
  "signatureEvidence": "synthetic reviewer signature evidence",
  "signatureEvidenceSha256": "3ac7e0efffa16b6b3fc3d5866c94542e9f7ab3c3ab27828391aa44f412c9c3d7"
}
